{
  "analysis_id": "shadow-analysis-sample",
  "timestamp": "2026-03-13T23:13:46.000Z",
  "market_state": {
    "symbol": "BTCUSDT",
    "interval": "1d",
    "as_of": "2026-03-13T23:59:59.999Z",
    "close": 71212.0,
    "return_1d": 0.009507,
    "return_3d": 0.018061,
    "return_7d": 0.045482,
    "volatility_regime": "low",
    "breakout": true,
    "volume_anomaly": false,
    "summary": "BTCUSDT 1d close=71212.0 return_1d=0.009507 volatility=low breakout=True volume_anomaly=False"
  },
  "dominant_hypothesis": "La volatilidad baja y el breakout sugieren continuidad, pero la cobertura sigue floja.",
  "supporting_factors": [
    "breakout reciente",
    "volatilidad contenida"
  ],
  "counterarguments": [
    "cobertura narrativa limitada"
  ],
  "retrieved_episodes": [
    {
      "episode_id": "ep_shadow",
      "score": 0.81,
      "summary_local": "Episodio previo comparable.",
      "dominant_cause": "market_only"
    }
  ],
  "confidence": 0.6,
  "recommended_action": "no_trade",
  "risk_level": "unknown",
  "why_now": [
    "breakout"
  ],
  "why_not": [
    "cobertura narrativa limitada"
  ],
  "data_coverage_score": 1.0,
  "narrative_coverage_score": 0.2,
  "final_status": "insufficient_evidence",
  "model_name": "qwen2.5:14b",
  "prompt_version": "bitnin-analyst-v0",
  "dataset_versions": {
    "market": "market-v0-binance-1d",
    "narrative": "narrative-v0-gdelt",
    "episodes": "episodes-v0-real"
  },
  "query_refs": [
    "/tmp/query.json"
  ],
  "notes": [
    "salida provisional"
  ]
}
